nombre_oficina,email,saludo
Iglesis arquitectos,taller@iglesisarquitectos.cl,Estimados miembros de Iglesis arquitectos
Martín Hurtado Arquitectos,contacto@martinhurtado.cl,Estimados miembros de Martín Hurtado Arquitectos
Aguiló + Pedraza,info@aguilopedraza.cl,Estimados miembros de Aguiló + Pedraza
Urbe Arquitectos,felix@urbe.cl,Estimados miembros de Urbe Arquitectos
Amunátegui Barreau,taller@abarchitec.com,Estimados miembros de Amunátegui Barreau
Turner Arquitectos,arq@turner.cl,Estimados miembros de Turner Arquitectos
Espiral Arquitectos,contacto@espiralarquitectos.com,Estimados miembros de Espiral Arquitectos
DAW,contacto@daw.cl,Estimados miembros de DAW
"Fuenzalida, Swinburn Arquitectos",fsaa@fsaa.cl,"Estimados miembros de Fuenzalida, Swinburn Arquitectos"
Irarrázabal Arquitectos,contacto@irarrazabal.cl,Estimados miembros de Irarrázabal Arquitectos
Prieto Schaffer Arquitectos,contacto@prietoschaffer.cl,Estimados miembros de Prieto Schaffer Arquitectos
Hsu-Rudolphy,ian@hsu-rudolphy.cl,Estimado Ian Hsu
Saa Arquitectura,araneda.s@gmail.com,Estimado Sergio
Crisosto Arquitectos Consultores,andrescrisosto@crisosto.cl,Estimado Andrés
Correa3,fmo@correa3.com,Estimado Felipe Martínez
Abarca y Palma Arquitectos,camilo@abarcapalma.com,Estimado Camilo
Duarte Arquitectos,info@duartearq.cl,Estimados miembros de Duarte Arquitectos